### ISSUE TITLE
postee-ui SMTP port not recognized

### ISSUE THREAD

**Issue by poggenpower** [aquasecurity/postee#236]
If I configure a SMTP output via postee-ui and use the test function the test runs via port 25 regardless which port is given into the "port" field of the config dialogue.
In the case above I have used the common port 587, but the communication went out trough port 25

23:23:09.418069 IP 10.252.248.175.59663 > 85.214.223.118.25: Flags [S], seq 2249252255, win 65535, options [mss 1380,nop,wscale 6,nop,nop,TS val 1217821634 ecr 0,sackOK,eol], length 0
23:23:09.557127 IP 85.214.223.118.25 > 10.252.248.175.59663: Flags [S.], seq 334525364, ack 2249252256, win 28960, options [mss 1460,sackOK,TS val 1399993551 ecr 1217821634,nop,wscale 8], length 0
23:23:09.557195 IP 10.252.248.175.59663 > 85.214.223.118.25: Flags [.], ack 1, win 2052, options [nop,nop,TS val 1217821773 ecr 1399993551], length 0
23:23:09.699207 IP 85.214.223.118.25 > 10.252.248.175.59663: Flags [P.], seq 1:43, ack 1, win 114, options [nop,nop,TS val 1399993693 ecr 1217821773], length 42: SMTP: 220 schmu.net ESMTP Postfix (Debian/GNU)
23:23:09.699261 IP 10.252.248.175.59663 > 85.214.223.118.25: Flags [.], ack 43, win 2051, options [nop,nop,TS val 1217821915 ecr 1399993693], length 0
